{
  "$schema": "../../../../contracts/v1/project.schema.json",
  "schema": "identity.project/v1",
  "project": {
    "id": "example-minimal",
    "displayName": "Example Minimal",
    "repository": "https://example.invalid/example-minimal",
    "tagline": "A synthetic minimal Identity v1 authoring example.",
    "kind": "repository"
  },
  "layers": [
    {
      "id": "example-organization",
      "kind": "organization-defaults",
      "priority": 0,
      "tokens": ".identity/defaults/organization.tokens.json",
      "sha256": "7bb0d007e84dc26b3f700eb4f5507d070dcb65db29cc7f313888b10bb16378aa"
    },
    {
      "id": "example-minimal",
      "kind": "product-override",
      "priority": 10,
      "tokens": ".identity/overrides/product.tokens.json",
      "sha256": "4d7a1112ec1d71259d8d5eea9b017a811dde53ca2c3ed15e65fbc37c29d9d781"
    }
  ],
  "documents": {
    "brief": ".identity/brief.md",
    "targets": ".identity/targets/profiles.json",
    "provenance": ".identity/governance/provenance.json",
    "approvals": ".identity/governance/approvals.json",
    "guidance": {
      "voice": null,
      "usage": null
    }
  },
  "directories": {
    "sources": ".identity/sources",
    "candidates": ".identity/candidates",
    "references": ".identity/references"
  },
  "compatibility": {
    "acceptedSchemaMajor": 1,
    "migrationFrom": []
  }
}
